{
  "v": 1,
  "task_id": "00000000-0000-4000-8000-000000000001",
  "device_id": "00000000-0000-4000-8000-000000000002",
  "actor_id": "00000000-0000-4000-8000-000000000003",
  "action": "exec",
  "argv": [
    "/usr/bin/printf",
    "fleet: %s\\n",
    "你好, fleet 👋"
  ],
  "cwd": "/tmp",
  "created_at": 1735689600000,
  "expires_at": 1735689660000,
  "timeout_ms": 5000,
  "max_output_bytes": 65536,
  "payload_hash": "eca4fda56f783d84468340f144040d5d8438021d67f83fda25413338da5277e4",
  "status": "SUCCEEDED",
  "last_seq": 3,
  "cancel_requested": false,
  "result": {
    "status": "SUCCEEDED",
    "exit_code": 0,
    "reason": null,
    "audit_complete": true,
    "stdout": {
      "sha256": "e3b0c44298fc1c149afbf4c8996fb92427ae41e4649b934ca495991b7852b855",
      "size": 0
    },
    "stderr": {
      "sha256": "e3b0c44298fc1c149afbf4c8996fb92427ae41e4649b934ca495991b7852b855",
      "size": 0
    },
    "started_at": 1735689600100,
    "finished_at": 1735689600110,
    "cleanup": "process_group"
  }
}
